{
    "source_id": 2025,
    "type": "page",
    "status": "publish",
    "slug": "search",
    "title": "Search",
    "parent": null,
    "menu_order": 0,
    "url_path": "/search/",
    "link": "https://kme.test/search/",
    "template": "",
    "content_raw": "",
    "excerpt": "",
    "date_gmt": "2024-11-13T10:46:13+00:00",
    "modified_gmt": "2024-12-05T11:53:16+00:00",
    "author": {
        "login": "author-1",
        "email": "author-1@example.invalid"
    },
    "featured_media": null,
    "attachments": [],
    "meta": {},
    "acf": {
        "blocks": [
            {
                "type": "collection",
                "block_title": "",
                "appearance": "cards",
                "layout": "3over4",
                "automatic_navigation": 0,
                "text": "",
                "pinned": false
            }
        ],
        "change_history": false,
        "publish_date_hidden": "0",
        "summary": "",
        "summary_hidden": "0"
    },
    "terms": {},
    "original_post_id": null,
    "embeds": [],
    "links": [],
    "blocks_used": {},
    "presets_used": [],
    "rendered": {},
    "revisions": [
        {
            "revision_id": 2758,
            "date_gmt": "2024-11-26T14:50:05+00:00",
            "author": {
                "login": "author-1",
                "email": "author-1@example.invalid"
            },
            "title": "Search",
            "excerpt": "",
            "content_raw": ""
        },
        {
            "revision_id": 3000,
            "date_gmt": "2024-11-29T14:41:20+00:00",
            "author": {
                "login": "author-1",
                "email": "author-1@example.invalid"
            },
            "title": "Search",
            "excerpt": "",
            "content_raw": ""
        }
    ],
    "archives": [],
    "content_sha256": "7bdb20b8ca1de7ca5d93e56e009d7befff3c64939c45a3a7523288caa7eec2b0"
}
