{
    "source_id": 1561,
    "type": "attachment",
    "status": "inherit",
    "slug": "cybersecurity-concept-internet-security-screen-with-padlock",
    "title": "cybersecurity concept, internet security, screen with padlock",
    "parent": 1496,
    "menu_order": 0,
    "url_path": "/latest-reports/cybersecurity-concept-internet-security-screen-with-padlock/",
    "link": "https://kme.test/latest-reports/cybersecurity-concept-internet-security-screen-with-padlock/",
    "template": "",
    "content_raw": "",
    "excerpt": "cybersecurity concept, internet security, screen with padlock",
    "date_gmt": "2024-10-24T12:56:11+00:00",
    "modified_gmt": "2024-10-24T12:56:11+00:00",
    "author": {
        "login": "author-1",
        "email": "author-1@example.invalid"
    },
    "featured_media": null,
    "attachments": [],
    "meta": {},
    "acf": {},
    "terms": {},
    "term_names": {},
    "original_post_id": null,
    "embeds": [],
    "links": [],
    "blocks_used": {},
    "presets_used": [],
    "rendered": {},
    "revisions": [],
    "archives": [],
    "content_sha256": "64d7b1a1a0efa00850e3fb2abb5e62edb382f87a66bb9a66e35620c66f8ccadd"
}
